Category,Condition,Current_Price,Image_URL,Manufacturer,Merchant_SKU,MPN,Original_Price,Product_Description,Product_Name,Product_URL,Shipping_Rate,SKU_BID,Stock_Availability,UPC
Software > Computer Software > Antivirus & Security Software,New,8.5,https://cdn1-prodint.esetstatic.com/ESET/US/products/home/box/DriveSecurity-box-225x333.png,ESET,DSE,DSE-N1-1,8.5,"As companies become more mobile, employees are transporting files and critical data on USB Flash drives to do their jobs on the go. And it’s no different with personal files at home. While portable drives offer convenience, they also leave room for users to unknowingly load infected files, spreading viruses from one machine to another. According to a Verizon Data Breach Investigation report, 35% of users are vulnerable to USB-initiated attacks. ESET offers the Kingston DTVP 3.0 USB Flash drive with DriveSecurity to keep your data safe wherever you work, no matter which device you load information from. Easy-to-use and no installation required so you can plug in and start using immediately.",DriveSecurity powered by ESET®,https://www.eset.com/us/home/usb-drive-security/,,0.99,YES,833062000004
Software > Computer Software > Antivirus & Security Software,New,39.99,https://cdn1.esetstatic.com/eset/US/pages/product/productBoxShots/feed/ESET-Cyber-Security-707x1000.jpg,ESET,ECS,ECS-N1-1,39.99,"ESET Cyber Security Mac Antivirus. ESET adds a layer of virus protection to your Mac® so you can stay confident with powerful detection of Mac- and Windows®- based threats. Enjoy the full power of your Mac with antivirus protection that leaves more power for programs you use daily to work, play and browse the Internet without slowdowns. This security package includes complimentary Cybersecurity Training and Free U.S.-based Technical Support. 1 Year License.",ESET Cyber Security Mac Antivirus,https://www.eset.com/us/home/cyber-security/#?users=1&years=1,,0.99,YES,833691009829
Software > Computer Software > Antivirus & Security Software,New,59.99,https://cdn1.esetstatic.com/eset/US/pages/product/productBoxShots/feed/ESET-Cyber-Security-707x1000.jpg,ESET,ECS-N2,ECS-N1-1,59.99,"ESET Cyber Security Mac Antivirus. ESET adds a layer of virus protection to your Mac® so you can stay confident with powerful detection of Mac- and Windows®- based threats. Enjoy the full power of your Mac with antivirus protection that leaves more power for programs you use daily to work, play and browse the Internet without slowdowns. This security package includes complimentary Cybersecurity Training and Free U.S.-based Technical Support. 2 Year License.",ESET Cyber Security Mac Antivirus 2 Year,https://www.eset.com/us/home/cyber-security/,,0.99,YES,833691010603
Software > Computer Software > Antivirus & Security Software,New,59.99,https://cdn1.esetstatic.com/eset/US/pages/product/productBoxShots/feed/ESET-Cyber-Security-Pro-707x1000.jpg,ESET,ECSP,ECSP-N1-1,59.99,"ESET Cyber Security Pro - complete security for your Mac with fast and powerful detection of Mac- and Windows-based threats. Enjoy the full power of your Mac with antivirus protection that leaves more power for programs you use daily to work, play and browse the Internet without slowdowns. This Mac Antivirus comes with Personal Firewall, that protects you against identity theft and other scams while Parental Control and Cybersecurity Training make your family’s online experience even safer. Free U.S.-based Technical Support included. 1 Year License.",ESET Cyber Security Pro Mac Antivirus,https://www.eset.com/us/home/cyber-security-pro/#?users=1&years=1,,0.99,YES,833691009850
Software > Computer Software > Antivirus & Security Software,New,59.99,https://cdn1.esetstatic.com/eset/US/pages/product/productBoxShots/feed/ESET-Cyber-Security-Pro-707x1000.jpg,ESET,ECSP-N2,ECSP-N1-1,59.99,"ESET Cyber Security Pro - complete security for your Mac with fast and powerful detection of Mac- and Windows-based threats. Enjoy the full power of your Mac with antivirus protection that leaves more power for programs you use daily to work, play and browse the Internet without slowdowns. This Mac Antivirus comes with Personal Firewall, that protects you against identity theft and other scams while Parental Control and Cybersecurity Training make your family’s online experience even safer. Free U.S.-based Technical Support included.",ESET Cyber Security Pro Mac Antivirus 2 Year,https://www.eset.com/us/home/cyber-security-pro/,,0.99,YES,833691010610
Software > Computer Software > Antivirus & Security Software,New,59.99,https://cdn1.esetstatic.com/eset/US/pages/product/productBoxShots/feed/ESET-Internet-Security-707x1000.jpg,ESET,EIS,EIS-N1-1,59.99,"ESET Internet Security (formerly Smart Security), all-in-one internet security for your Windows® PC with new Anti-theft, Social Media scanner, Personal Firewall and Anti-Phishing safeguard your personal info. A safer online experience begins with ESET Internet Security - proven Antivirus and Antispyware. This package includes complimentary Cybersecurity Training and Free U.S.-based Technical Support. 1 Year License.",ESET Internet Security,https://www.eset.com/us/home/internet-security/#?users=1&years=1,,0.99,YES,833691010122
Software > Computer Software > Antivirus & Security Software,New,89.99,https://cdn1.esetstatic.com/eset/US/pages/product/productBoxShots/feed/ESET-Internet-Security-707x1000.jpg,ESET,EIS-N2,EIS-N1-1,89.99,"ESET Internet Security (formerly Smart Security), all-in-one internet security for your Windows® PC with new Anti-theft, Social Media scanner, Personal Firewall and Anti-Phishing safeguard your personal info. A safer online experience begins with ESET Internet Security - proven Antivirus and Antispyware. This package includes complimentary Cybersecurity Training and Free U.S.-based Technical Support. 2 Year License.",ESET Internet Security 2 Year,https://www.eset.com/us/home/internet-security/,,0.99,YES,833691010580
Software > Computer Software > Antivirus & Security Software,New,9.95,https://cdn1.esetstatic.com/eset/US/pages/product/productBoxShots/feed/ESET-Mobile-Security-707x1000.jpg,ESET,EMS,EMSH-N1-1,9.95,"ESET Mobile Security. Specially designed for the Android platform, ESET Mobile Security for Android phones and tablets combines the award-winning ESET antivirus engine with powerful antitheft and antispam to provide real-time protection against known and emerging mobile threats. AV-TEST approved with 6/6 Protection score and 100 percent malicious sample detection rate. Free Technical Support included.",ESET Mobile Security for Android,https://www.eset.com/us/home/mobile-security-android/,,0.99,YES,833691005999
Software > Computer Software > Antivirus & Security Software,New,84.99,https://cdn1.esetstatic.com/eset/US/pages/product/productBoxShots/feed/ESET-Multi-Device-Security-707x1000.jpg,ESET,EMDS,EMDS-N1-1,84.99,"ESET Multi Device Security Pack. ESET makes protecting all your devices simple, convenient and affordable. This antivirus bundle features ESET Unilicense, that allows you to conveniently mix and match award-winning Internet security for your Windows® and Mac® computers and Android™ smartphones and tablets. Cybersecurity Training and Free U.S.-based Technical Support included.",ESET Multi-Device Security,https://www.eset.com/us/home/multi-device-security/,,0.99,NO,833691010627
Software > Computer Software > Antivirus & Security Software,New,39.99,https://cdn1.esetstatic.com/eset/US/pages/product/productBoxShots/feed/ESET-NOD32-forLinux-707x1000.jpg,ESET,EAVHL,EAVHL-N1-1,39.99,"ESET NOD32 Antivirus for Linux, an award-winning antivirus software featuring an improved Anti-Phishing module and fast and powerful detection of viruses, worms, Trojans, rootkits and other malware. ESET NOD32 receives near-universal top ratings from Icsa Labs, AV-Comparatives, West Coast Labs and Virus Bulletin. This Antivirus comes with complimentary Cybersecurity Training that teaches you tips and techniques for making your online experience even safer. Free U.S.-based Technical Support included.",ESET NOD32 Linux Antivirus 1 Year,https://www.eset.com/us/home/antivirus-linux/,,0.99,YES,833691010665
Software > Computer Software > Antivirus & Security Software,New,59.99,https://cdn1.esetstatic.com/eset/US/pages/product/productBoxShots/feed/ESET-NOD32-forLinux-707x1000.jpg,ESET,EAVHL-N2,EAVHL-N1-1,59.99,"ESET NOD32 Antivirus for Linux, an award-winning antivirus software featuring an improved Anti-Phishing module and fast and powerful detection of viruses, worms, Trojans, rootkits and other malware. ESET NOD32 receives near-universal top ratings from Icsa Labs, AV-Comparatives, West Coast Labs and Virus Bulletin. This Antivirus comes with complimentary Cybersecurity Training that teaches you tips and techniques for making your online experience even safer. Free U.S.-based Technical Support included.",ESET NOD32 Linux Antivirus 2 Year,https://www.eset.com/us/home/antivirus-linux/#?years=2&users=1,,0.99,YES,833691010672
Software > Computer Software > Antivirus & Security Software,New,19.99,https://cdn1.esetstatic.com/eset/US/pages/product/productBoxShots/feed/ESET-NOD32-Antivirus-10-707x1000.jpg,ESET,EAVH-19.99,EAVH-N1-1,19.99,"ESET NOD32 Antivirus, an award-winning antivirus software featuring an improved Anti-Phishing module and fast and powerful detection of viruses, worms, Trojans, rootkits and other malware. ESET NOD32 receives near-universal top ratings from Icsa Labs, AV-Comparatives, West Coast Labs and Virus Bulletin. This Antivirus comes with complimentary Cybersecurity Training that teaches you tips and techniques for making your online experience even safer. Free U.S.-based Technical Support included. 1 Year License.",ESET NOD32 Windows Antivirus - 1 Year,https://offers.eset.com/nod32-antivirus-promo/,,0.99,YES,833691010030
Software > Computer Software > Antivirus & Security Software,New,39.99,https://cdn1.esetstatic.com/eset/US/pages/product/productBoxShots/feed/ESET-NOD32-Antivirus-10-707x1000.jpg,ESET,EAVH,EAVH-N1-1,39.99,"ESET NOD32 Antivirus, an award-winning antivirus software featuring an improved Anti-Phishing module and fast and powerful detection of viruses, worms, Trojans, rootkits and other malware. ESET NOD32 receives near-universal top ratings from Icsa Labs, AV-Comparatives, West Coast Labs and Virus Bulletin. This Antivirus comes with complimentary Cybersecurity Training that teaches you tips and techniques for making your online experience even safer. Free U.S.-based Technical Support included.",ESET NOD32 Windows Antivirus 1 Year,https://www.eset.com/us/home/antivirus/#?years=1&users=1,,0.99,YES,833691010030
Software > Computer Software > Antivirus & Security Software,New,59.99,https://cdn1.esetstatic.com/eset/US/pages/product/productBoxShots/feed/ESET-NOD32-Antivirus-10-707x1000.jpg,ESET,EAVH-N2,EAVH-N1-1,59.99,"ESET NOD32 Antivirus, an award-winning antivirus software featuring an improved Anti-Phishing module and fast and powerful detection of viruses, worms, Trojans, rootkits and other malware. ESET NOD32 receives near-universal top ratings from Icsa Labs, AV-Comparatives, West Coast Labs and Virus Bulletin. This Antivirus comes with complimentary Cybersecurity Training that teaches you tips and techniques for making your online experience even safer. Free U.S.-based Technical Support included. 2 Year License",ESET NOD32 Windows Antivirus 2 Year,https://www.eset.com/us/home/antivirus/,,0.99,YES,833691010061
Software > Computer Software > Antivirus & Security Software,New,29.99,https://cdn1.esetstatic.com/eset/US/pages/product/productBoxShots/feed/ESET-Parental-Control-707x1000.jpg,ESET,EPCH,EPCH-N1-1,29.99,"Feel confident about the time your children spend online with ESET's new Parental Control for Android. Designed to promote collaboration between kids and parents, the app lets you block inappropriate apps or websites, set limits on time usage, and allow additional time or access in response to a child's request. For even more peace of mind, you can locate children any time via any of their connected devices. And, you can stay in touch: this app solves the issue of children ignoring your texts or calls by requiring that they acknowledge the message before they can continue using their device.",ESET Parental Control for Android,https://www.eset.com/us/home/parental-control-android/,,0.99,YES,833061000005
Software > Computer Software > Antivirus & Security Software,New,324.95,https://cdn1-prodint.esetstatic.com/ESET/US/products/business/box/BoxShot-ESB-195x276.png,ESET,ESB,ESB-N1,324.95,"Protect all computers, laptops, mobile devices and fileservers – and make your email gateway impenetrable, eliminating all types of email-borne malware at the server level – before it can do any damage. For network security choose ESET, the pioneer of antivirus industry for 25 years.",ESET Secure Business,https://www.eset.com/us/business/security-solutions/secure-business/,,0.99,YES,833691010504
Software > Computer Software > Antivirus & Security Software,New,209.95,https://cdn2-prodint.esetstatic.com/ESET/US/products/business/box/BoxShot-EPA-195x276.png,ESET,EEPA,EEPA-N1,209.95,"On top of ESET Endpoint Protection Standard, the Advanced version comes with the powerful Web Control, Firewall and Anti-Spam filter to provide additional layers of protection for your company network and your mobile workforce. For network security choose ESET, the pioneer of antivirus industry for 25 years.",ESET Small Business Endpoint Protection Advanced,https://www.eset.com/us/business/security-solutions/protection-advanced/,,0.99,YES,833691010481
Software > Computer Software > Antivirus & Security Software,New,179.95,https://cdn1-prodint.esetstatic.com/ESET/US/products/business/box/BoxShot-EPS-195x276.png,ESET,EEPS,EEPS-N1-1,179.95,"Keep your network clean and protect your endpoints (computers, smartphones, tablets, and file server) against emerging threats and data theft with security that is easily manageable from a single console. For network security choose ESET, the pioneer of antivirus for 25 years.",ESET Small Business Endpoint Protection Standard,https://www.eset.com/us/business/security-solutions/protection-standard/,,0.99,YES,833691010467
Software > Computer Software > Antivirus & Security Software,New,379.99,https://cdn1.esetstatic.com/eset/US/pages/product/productBoxShots/feed/ESBSP-691x1000.jpg,ESET,ESBSP,ESBSP-N1,379.99,"Powered by proven NOD32® technology, an ESET Security Pack is an all-in-one business antivirus that protects your workstations, file server, mobile devices and company email from malware, spam and phishing scams. This security pack features advanced Endpoint Security or Endpoint Antivirus (5 seats), Endpoint Security for Android Devices (5 seats), File Security (1 server) and Mail Security (1 server plus 8 mailboxes).",ESET Small Business Security Pack,https://www.eset.com/us/business/security-packs/small-business-security-pack/,,0.99,YES,833058000001
Software > Computer Software > Antivirus & Security Software,New,149.99,https://cdn1.esetstatic.com/eset/US/pages/product/productBoxShots/feed/ESOSP-691x1000.jpg,ESET,ESOSPHO,ESOSPHO-N1,149.99,"ESET Small Office Security Pack Antivirus is an all-in-one protection for your entire office, including BYOD Antivirus software for your Windows® PC with new Anti-theft, Social Media scanner, Personal Firewall and Anti-Phishing safeguard your personal info. A safer online experience begins with ESET Smart Security - proven antivirus and antivirus. This package includes complimentary Cybersecurity Training and Free U.S.-based Technical Support.",ESET Small Office Security - Home Office,https://www.eset.com/us/business/security-packs/small-office-security-pack/,,0.99,YES,833059000000
Software > Computer Software > Antivirus & Security Software,New,79.99,https://cdn1.esetstatic.com/eset/US/pages/product/productBoxShots/feed/ESET-Smart-Security-Premium-707x1000.jpg,ESET,ESSP,ESSP-N1-1,79.99,"ESET Smart Security Premium. Advanced, multi-layered detection and prevention with advanced premium features including anti-theft, a password manager, and encryption. ESET makes protecting all your devices simple, convenient and affordable. This antivirus bundle features ESET Unilicense, that allows you to conveniently mix and match award-winning Internet security for your Windows® and Mac® computers and Android™ smartphones and tablets. Cybersecurity Training and Free U.S.-based Technical Support included.",ESET Smart Security Premium,https://www.eset.com/us/home/smart-security-premium,,0.99,YES,833691010184
Electronics > Electronics Accessories > Computer Components > Storage Devices > USB Flash Drives,New,39.99,https://cdn1-prodint.esetstatic.com/ESET/US/products/kingston-225x276.jpg,Kingston,KDS,KDS-N1,39.99,"ESET offers the Kingston DTVP 3.0 USB Flash drive with DriveSecurity to keep your data safe wherever you work, no matter which device you load information from. Easy-to-use and no installation required so you can plug in and start using immediately.",Kingston DataTraveler Vault Privacy 3.0 with DriveSecurity powered by ESET®,https://www.eset.com/us/business/kingston-datatraveler/,,0.99,YES,833691010689
